scripts/bao_data_swiglu.csv
,BLOCK_SIZE,num_warps,num_stages,runtime,d,tokens,GPU
0,16,1,2,13.333503723144531,9722,14058,V100
1,128,32,5,6.5382399559021,9722,14058,V100
2,2048,8,0,1.141759991645813,9722,14058,V100
3,1024,4,5,1.2282880544662476,9722,14058,V100
4,256,4,3,1.753600001335144,9722,14058,V100
5,128,32,0,6.518784046173096,9722,14058,V100
6,512,4,0,1.358847975730896,9722,14058,V100
7,16,8,0,13.341695785522461,9722,14058,V100
8,128,1,4,2.4586238861083984,9722,14058,V100
9,2048,8,1,1.1407359838485718,9722,14058,V100
10,16,16,0,4.333568096160889,3281,8510,V100
11,256,4,0,0.3553279936313629,3281,8510,V100
12,2048,2,0,0.24166400730609894,3281,8510,V100
13,8192,8,0,0.2519040107727051,3281,8510,V100
14,128,8,1,0.44441598653793335,3281,8510,V100
15,2048,4,1,0.2396160066127777,3281,8510,V100
16,512,32,1,0.4249599874019623,3281,8510,V100
17,128,32,2,1.3434879779815674,3281,8510,V100
18,1024,2,0,0.2693119943141937,3281,8510,V100
19,8192,8,1,0.2519040107727051,3281,8510,V100
20,2048,2,1,2.5518081188201904,10545,26350,V100
21,512,1,0,3.241472005844116,10545,26350,V100
22,512,32,4,3.99564790725708,10545,26350,V100
23,256,2,0,4.040703773498535,10545,26350,V100
24,32,4,3,13.87007999420166,10545,26350,V100
25,128,32,5,13.403136253356934,10545,26350,V100
26,4096,32,5,2.283519983291626,10545,26350,V100
27,256,2,3,4.0417280197143555,10545,26350,V100
28,4096,16,3,2.3255040645599365,10545,26350,V100
29,8192,32,5,2.5077760219573975,10545,26350,V100
30,4096,8,5,1.3475840091705322,311,89991,V100
31,4096,1,5,5.42412805557251,311,89991,V100
32,256,1,4,0.35225600004196167,311,89991,V100
33,512,16,0,0.2815999984741211,311,89991,V100
34,2048,2,0,0.6502400040626526,311,89991,V100
35,32,2,4,1.4090240001678467,311,89991,V100
36,8192,1,0,85.80608367919922,311,89991,V100
37,128,16,1,0.7946239709854126,311,89991,V100
38,16,2,4,2.8129279613494873,311,89991,V100
39,2048,16,4,0.6256639957427979,311,89991,V100
40,1024,1,5,0.7014399766921997,13668,5778,V100
41,32,16,5,6.345727920532227,13668,5778,V100
42,128,4,0,0.9953280091285706,13668,5778,V100
43,64,1,2,1.9343359470367432,13668,5778,V100
44,4096,8,5,0.6184960007667542,13668,5778,V100
45,64,8,1,1.9415040016174316,13668,5778,V100
46,1024,16,4,0.6814720034599304,13668,5778,V100
47,1024,4,2,0.6666240096092224,13668,5778,V100
48,16,1,1,7.709695816040039,13668,5778,V100
49,16,32,3,25.447423934936523,13668,5778,V100
50,128,1,4,7.878144025802612,5390,80032,V100
51,512,1,0,4.362239837646484,5390,80032,V100
52,16,8,4,42.0945930480957,5390,80032,V100
53,4096,8,1,3.4780160188674927,5390,80032,V100
54,4096,8,0,3.4795520305633545,5390,80032,V100
55,32,8,0,21.134336471557617,5390,80032,V100
56,16,1,5,42.06847953796387,5390,80032,V100
57,2048,8,0,3.57478404045105,5390,80032,V100
58,256,16,1,5.598207950592041,5390,80032,V100
59,2048,4,4,3.6485118865966797,5390,80032,V100
60,16,4,1,19.88761615753174,4678,43500,V100
61,256,16,2,2.6163198947906494,4678,43500,V100
62,32,32,1,35.83590507507324,4678,43500,V100
63,32,2,0,9.977855682373047,4678,43500,V100
64,128,4,0,3.6710400581359863,4678,43500,V100
65,8192,4,1,1.5544320344924927,4678,43500,V100
66,1024,8,2,1.738752007484436,4678,43500,V100
67,64,2,1,5.750783920288086,4678,43500,V100
68,64,4,2,5.784064054489136,4678,43500,V100
69,2048,2,2,1.7131520509719849,4678,43500,V100
70,128,32,5,36.22297668457031,10892,69269,V100
71,128,1,1,12.420096397399902,10892,69269,V100
72,32,16,3,65.23085021972656,10892,69269,V100
73,16,1,3,73.56928253173828,10892,69269,V100
74,2048,8,4,6.008831977844238,10892,69269,V100
75,4096,1,4,5.8470399379730225,10892,69269,V100
76,2048,32,4,6.2320637702941895,10892,69269,V100
77,128,8,1,13.280256271362305,10892,69269,V100
78,256,32,4,19.4201602935791,10892,69269,V100
79,64,4,2,9.426431655883789,9297,33653,V100
80,128,32,1,15.105535984039307,9297,33653,V100
81,4096,8,2,2.817023992538452,9297,33653,V100
82,1024,2,3,3.0566399097442627,9297,33653,V100
83,64,32,4,28.95769691467285,9297,33653,V100
84,256,2,1,4.46668815612793,9297,33653,V100
85,32,32,3,55.52435302734375,9297,33653,V100
86,64,2,3,9.323520183563232,9297,33653,V100
87,256,16,4,4.098559856414795,9297,33653,V100
88,1024,1,0,3.0141440629959106,9297,33653,V100
89,64,8,0,12.505087852478027,5991,67872,V100
90,2048,2,3,3.5092480182647705,5991,67872,V100
91,128,32,0,19.512319564819336,5991,67872,V100
92,256,4,1,5.397503852844238,5991,67872,V100
93,512,4,3,4.262911796569824,5991,67872,V100
94,4096,32,0,3.383296012878418,5991,67872,V100
95,512,8,5,4.097024202346802,5991,67872,V100
96,2048,32,2,3.3822720050811768,5991,67872,V100
97,256,2,4,5.7236480712890625,5991,67872,V100
98,512,4,0,4.257791996002197,5991,67872,V100
99,2048,4,1,0.07577600330114365,15457,534,V100
100,512,16,4,0.07680000364780426,15457,534,V100
101,32,4,0,0.40857601165771484,15457,534,V100
102,16,1,1,0.8110079765319824,15457,534,V100
103,8192,16,5,0.07372800260782242,15457,534,V100
104,256,1,5,0.07475200295448303,15457,534,V100
105,4096,2,0,0.07884799689054489,15457,534,V100
106,4096,2,5,0.07884799689054489,15457,534,V100
107,64,2,3,0.20684799551963806,15457,534,V100
108,256,16,5,0.11059200018644333,15457,534,V100
109,8192,32,0,0.035840000957250595,3803,848,V100
110,128,1,4,0.04505600035190582,3803,848,V100
111,64,32,5,0.2887679934501648,3803,848,V100
112,4096,2,0,0.03686400130391121,3803,848,V100
113,32,16,3,0.26009601354599,3803,848,V100
114,2048,8,1,0.03276799991726875,3803,848,V100
115,8192,8,4,0.035840000957250595,3803,848,V100
116,1024,1,1,0.035840000957250595,3803,848,V100
117,64,1,4,0.08396799862384796,3803,848,V100
118,32,8,1,0.16281600296497345,3803,848,V100
119,16,8,0,3.3822720050811768,5988,5775,V100
120,256,32,4,0.9041919708251953,5988,5775,V100
121,32,8,1,1.698815941810608,5988,5775,V100
122,64,2,2,0.851967990398407,5988,5775,V100
123,1024,2,2,0.2949120104312897,5988,5775,V100
124,512,1,3,0.32153600454330444,5988,5775,V100
125,2048,32,1,0.27852800488471985,5988,5775,V100
126,128,2,5,0.4362240135669708,5988,5775,V100
127,32,1,2,1.6977920532226562,5988,5775,V100
128,16,8,1,3.3822720050811768,5988,5775,V100
129,4096,2,2,0.19353599846363068,11299,1904,V100
130,256,2,2,0.2099200040102005,11299,1904,V100
131,1024,2,1,0.2099200040102005,11299,1904,V100
132,2048,8,0,0.1955839991569519,11299,1904,V100
133,256,8,2,0.2027519941329956,11299,1904,V100
134,2048,1,4,0.2027519941329956,11299,1904,V100
135,4096,4,4,0.187391996383667,11299,1904,V100
136,4096,4,0,0.187391996383667,11299,1904,V100
137,64,4,3,0.5304319858551025,11299,1904,V100
138,8192,8,1,0.1884160041809082,11299,1904,V100
139,8192,32,1,2.1022720336914062,13604,20480,V100
140,1024,4,1,2.404863953590393,13604,20480,V100
141,16,32,0,95.45728302001953,13604,20480,V100
142,1024,2,1,2.438655972480774,13604,20480,V100
143,256,32,0,7.206912040710449,13604,20480,V100
144,32,8,2,13.648896217346191,13604,20480,V100
145,4096,1,0,2.3152639865875244,13604,20480,V100
146,16,8,1,27.193344116210938,13604,20480,V100
147,2048,16,3,2.269184112548828,13604,20480,V100
148,128,2,4,5.146111965179443,13604,20480,V100
149,32,1,2,1.4315520524978638,13958,2093,V100
150,8192,8,2,0.2396160066127777,13958,2093,V100
151,128,32,4,1.3567999601364136,13958,2093,V100
152,8192,32,3,0.23552000522613525,13958,2093,V100
153,8192,16,1,0.2396160066127777,13958,2093,V100
154,4096,1,2,0.2682879865169525,13958,2093,V100
155,2048,32,5,0.2457599937915802,13958,2093,V100
156,512,1,4,0.2662400007247925,13958,2093,V100
157,2048,2,3,0.26009601354599,13958,2093,V100
158,64,2,5,0.719871997833252,13958,2093,V100
159,256,4,1,1.1438080072402954,7027,12288,V100
160,32,4,5,4.220928192138672,7027,12288,V100
161,4096,2,0,0.7311360239982605,7027,12288,V100
162,32,8,4,4.228096008300781,7027,12288,V100
163,2048,2,1,0.754688024520874,7027,12288,V100
164,1024,32,2,0.7741439938545227,7027,12288,V100
165,2048,2,2,0.754688024520874,7027,12288,V100
166,1024,1,5,0.796671986579895,7027,12288,V100
167,64,16,1,3.896320104598999,7027,12288,V100
168,64,4,2,2.14630389213562,7027,12288,V100
169,8192,16,4,7.784960031509399,14881,58650,V100
170,128,2,4,17.100799560546875,14881,58650,V100
171,32,32,4,154.8789825439453,14881,58650,V100
172,128,2,3,17.113088607788086,14881,58650,V100
173,16,2,5,85.15277099609375,14881,58650,V100
174,128,8,1,17.045503616333008,14881,58650,V100
175,512,8,2,9.005568027496338,14881,58650,V100
176,2048,1,0,8.014847755432129,14881,58650,V100
177,64,2,1,26.12735939025879,14881,58650,V100
178,128,16,1,3.1201279163360596,14116,9306,V100
179,8192,32,0,0.9902080297470093,14116,9306,V100
180,16,16,5,20.229631423950195,14116,9306,V100
181,8192,4,5,0.997376024723053,14116,9306,V100
182,64,2,1,3.2122879028320312,14116,9306,V100
183,16,1,5,12.819456100463867,14116,9306,V100
184,64,1,5,3.2122879028320312,14116,9306,V100
185,16,4,2,12.818431854248047,14116,9306,V100
186,4096,8,0,1.0383360385894775,14116,9306,V100
187,256,32,5,3.4094079732894897,14116,9306,V100
188,1024,1,5,0.02252800017595291,5333,345,V100
189,4096,8,2,0.02252800017595291,5333,345,V100
190,16,8,5,0.18534399569034576,5333,345,V100
191,2048,4,0,0.020479999482631683,5333,345,V100
192,2048,1,0,0.026623999699950218,5333,345,V100
193,16,4,4,0.18432000279426575,5333,345,V100
194,16,16,3,0.2815999984741211,5333,345,V100
195,1024,8,0,0.020479999482631683,5333,345,V100
196,64,8,5,0.05119999870657921,5333,345,V100
197,64,32,2,0.1669120043516159,5333,345,V100
