scripts/swiglu_data_bao_stop_non_two_1.csv
,BLOCK_SIZE,num_warps,num_stages,runtime,d,tokens,GPU
0,512,32,5,12.089855194091797,14059,66312,L40S
1,4096,8,2,9.375743865966797,14059,66312,L40S
2,64,1,1,14.270463943481445,14059,66312,L40S
3,256,16,2,12.131327629089355,14059,66312,L40S
4,128,32,2,30.485504150390625,14059,66312,L40S
5,1024,4,5,10.604543685913086,14059,66312,L40S
6,32,32,2,111.85254669189453,14059,66312,L40S
7,4096,8,4,9.385472297668457,14059,66312,L40S
8,2048,8,3,9.633279800415039,14059,66312,L40S
9,2048,1,2,9.569791793823242,14059,66312,L40S
10,4096,8,0,2.9183998107910156,14059,66312,L40S
11,1024,8,0,2.9480960369110107,14059,66312,L40S
12,16,8,0,2.944000005722046,14059,66312,L40S
13,4096,2,0,2.999807834625244,14059,66312,L40S
14,8192,8,0,3.274751901626587,14059,66312,L40S
15,4096,16,0,3.0018558502197266,14059,66312,L40S
16,512,8,0,2.7289600372314453,14059,66312,L40S
17,128,8,0,2.737152099609375,14059,66312,L40S
18,32,8,0,2.7315359115600586,14059,66312,L40S
19,32,4,2,2.7310080528259277,14059,66312,L40S
20,32,4,5,2.7299840450286865,14059,66312,L40S
21,128,4,4,2.728895902633667,14059,66312,L40S
22,32,1,1,3.3556480407714844,14059,66312,L40S
23,128,4,0,2.7289600372314453,14059,66312,L40S
24,32,4,0,2.7248640060424805,14059,66312,L40S
25,32,4,3,2.8088319301605225,14059,66312,L40S
26,128,1,2,2.7781119346618652,14059,66312,L40S
27,2048,32,1,2.7340800762176514,14059,66312,L40S
28,128,8,1,2.870271921157837,14059,66312,L40S
29,2048,32,4,2.742784023284912,14059,66312,L40S
30,64,32,4,2.7750401496887207,14059,66312,L40S
31,8192,4,2,2.736095905303955,14059,66312,L40S
32,32,1,2,2.7489280700683594,14059,66312,L40S
33,2048,32,2,2.747904062271118,14059,66312,L40S
34,64,2,1,2.7545599937438965,14059,66312,L40S
35,512,32,5,1.9845119714736938,4886,32250,L40S
36,4096,8,2,1.610751986503601,4886,32250,L40S
37,64,1,1,2.135040044784546,4886,32250,L40S
38,256,16,2,1.8421759605407715,4886,32250,L40S
39,128,32,2,5.2500481605529785,4886,32250,L40S
40,1024,4,5,1.793023943901062,4886,32250,L40S
41,32,32,2,18.792448043823242,4886,32250,L40S
42,4096,8,4,1.6117759943008423,4886,32250,L40S
43,2048,8,3,1.6721919775009155,4886,32250,L40S
44,2048,1,2,1.7305599451065063,4886,32250,L40S
45,4096,8,3,3.403775930404663,4886,32250,L40S
46,1024,8,1,3.1098880767822266,4886,32250,L40S
47,512,32,5,2.8538880348205566,13310,18042,L40S
48,4096,8,2,2.5113601684570312,13310,18042,L40S
49,64,1,1,3.083263874053955,13310,18042,L40S
50,256,16,2,2.6449921131134033,13310,18042,L40S
51,128,32,2,7.840767860412598,13310,18042,L40S
52,1024,4,5,2.6470398902893066,13310,18042,L40S
53,32,32,2,28.74470329284668,13310,18042,L40S
54,4096,8,4,2.510848045349121,13310,18042,L40S
55,2048,8,3,2.524127960205078,13310,18042,L40S
56,2048,1,2,2.600895881652832,13310,18042,L40S
57,4096,8,0,2.7832319736480713,13310,18042,L40S
58,4096,8,3,2.781183958053589,13310,18042,L40S
59,16,4,5,3.2931840419769287,13310,18042,L40S
60,1024,2,5,2.8231680393218994,13310,18042,L40S
61,8192,8,4,2.668544054031372,13310,18042,L40S
62,32,8,2,2.668032169342041,13310,18042,L40S
63,512,8,2,3.1784958839416504,13310,18042,L40S
64,128,8,4,2.678783893585205,13310,18042,L40S
65,512,32,5,3.140608072280884,5539,44084,L40S
66,4096,8,2,2.421247959136963,5539,44084,L40S
67,64,1,1,3.5348479747772217,5539,44084,L40S
68,256,16,2,2.953728199005127,5539,44084,L40S
69,128,32,2,8.101887702941895,5539,44084,L40S
70,1024,4,5,2.815999984741211,5539,44084,L40S
71,32,32,2,29.222911834716797,5539,44084,L40S
72,4096,8,4,2.4191999435424805,5539,44084,L40S
73,2048,8,3,2.5410561561584473,5539,44084,L40S
74,2048,1,2,2.535935878753662,5539,44084,L40S
75,4096,8,0,3.506175994873047,5539,44084,L40S
76,8192,8,4,2.706943988800049,5539,44084,L40S
77,16,8,2,2.7161598205566406,5539,44084,L40S
78,1024,2,5,2.7202558517456055,5539,44084,L40S
79,1024,1,0,2.824687957763672,5539,44084,L40S
80,2048,2,2,2.7089920043945312,5539,44084,L40S
81,256,4,5,2.7243518829345703,5539,44084,L40S
82,128,8,4,2.964479923248291,5539,44084,L40S
83,512,32,5,1.4561280012130737,2313,47601,L40S
84,4096,8,2,1.0711040496826172,2313,47601,L40S
85,64,1,1,1.6532479524612427,2313,47601,L40S
86,256,16,2,1.4284800291061401,2313,47601,L40S
87,128,32,2,3.7857279777526855,2313,47601,L40S
88,1024,4,5,1.2999680042266846,2313,47601,L40S
89,32,32,2,13.26591968536377,2313,47601,L40S
90,4096,8,4,1.0721280574798584,2313,47601,L40S
91,2048,8,3,1.1315200328826904,2313,47601,L40S
92,2048,1,2,1.154047966003418,2313,47601,L40S
93,4096,8,3,2.8728320598602295,2313,47601,L40S
94,2048,2,4,2.7136001586914062,2313,47601,L40S
95,512,32,5,5.444608211517334,8535,50779,L40S
96,4096,8,2,4.312064170837402,8535,50779,L40S
97,64,1,1,6.305791854858398,8535,50779,L40S
98,256,16,2,5.311488151550293,8535,50779,L40S
99,128,32,2,14.181375503540039,8535,50779,L40S
100,1024,4,5,4.9146881103515625,8535,50779,L40S
101,32,32,2,51.79084777832031,8535,50779,L40S
102,4096,8,4,4.325376033782959,8535,50779,L40S
103,2048,8,3,4.471296310424805,8535,50779,L40S
104,2048,1,2,4.459519863128662,8535,50779,L40S
105,4096,8,3,3.3679039478302,8535,50779,L40S
106,16,8,3,2.6664960384368896,8535,50779,L40S
107,16,2,3,2.6608638763427734,8535,50779,L40S
108,16,4,3,2.663936138153076,8535,50779,L40S
109,8192,2,3,2.6695680618286133,8535,50779,L40S
110,1024,2,0,2.6726560592651367,8535,50779,L40S
111,32,2,3,2.6670079231262207,8535,50779,L40S
112,4096,16,2,2.795520067214966,8535,50779,L40S
113,512,2,3,2.668032169342041,8535,50779,L40S
114,256,16,1,2.75763201713562,8535,50779,L40S
115,32,4,5,2.6557440757751465,8535,50779,L40S
116,128,4,5,2.659855842590332,8535,50779,L40S
117,64,2,3,2.669055938720703,8535,50779,L40S
118,32,1,5,3.0269761085510254,8535,50779,L40S
119,128,4,3,2.6859519481658936,8535,50779,L40S
120,128,16,2,2.6818559169769287,8535,50779,L40S
121,32,16,2,2.6951680183410645,8535,50779,L40S
122,128,16,1,2.6746881008148193,8535,50779,L40S
123,2048,32,2,2.8088319301605225,8535,50779,L40S
124,2048,16,2,2.653183937072754,8535,50779,L40S
125,256,2,0,2.6603519916534424,8535,50779,L40S
126,256,32,3,2.6552319526672363,8535,50779,L40S
127,32,16,4,2.7643041610717773,8535,50779,L40S
128,2048,16,1,2.7904000282287598,8535,50779,L40S
129,4096,16,1,2.748415946960449,8535,50779,L40S
130,128,2,0,2.697728157043457,8535,50779,L40S
131,2048,16,5,3.3454079627990723,8535,50779,L40S
132,32,1,0,2.712575912475586,8535,50779,L40S
133,2048,32,3,2.6767361164093018,8535,50779,L40S
134,1024,16,1,2.697216033935547,8535,50779,L40S
135,512,32,5,6.228928089141846,8812,55650,L40S
136,4096,8,2,4.9791998863220215,8812,55650,L40S
137,64,1,1,6.776832103729248,8812,55650,L40S
138,256,16,2,6.012928009033203,8812,55650,L40S
139,128,32,2,16.012798309326172,8812,55650,L40S
140,1024,4,5,5.47327995300293,8812,55650,L40S
141,32,32,2,58.605567932128906,8812,55650,L40S
142,4096,8,4,4.977663993835449,8812,55650,L40S
143,2048,8,3,5.05241584777832,8812,55650,L40S
144,2048,1,2,5.087743759155273,8812,55650,L40S
145,4096,8,0,2.815999984741211,8812,55650,L40S
146,8192,8,0,2.766848087310791,8812,55650,L40S
147,16,8,0,2.6736960411071777,8812,55650,L40S
148,1024,8,0,2.658815860748291,8812,55650,L40S
149,1024,2,5,2.7919199466705322,8812,55650,L40S
150,512,8,0,2.6890079975128174,8812,55650,L40S
151,256,8,0,3.329040050506592,8812,55650,L40S
152,1024,8,5,2.6859519481658936,8812,55650,L40S
153,32,1,4,2.6946558952331543,8812,55650,L40S
154,64,8,1,2.6808319091796875,8812,55650,L40S
155,32,16,0,2.7013120651245117,8812,55650,L40S
156,32,8,1,2.6751999855041504,8812,55650,L40S
157,32,32,4,2.721280097961426,8812,55650,L40S
158,4096,32,2,2.6603519916534424,8812,55650,L40S
159,512,32,5,0.30928000807762146,3066,7503,L40S
160,4096,8,2,0.22630399465560913,3066,7503,L40S
161,64,1,1,0.3235839903354645,3066,7503,L40S
162,256,16,2,0.2805759906768799,3066,7503,L40S
163,128,32,2,0.7761920094490051,3066,7503,L40S
164,1024,4,5,0.26316800713539124,3066,7503,L40S
165,32,32,2,2.770944118499756,3066,7503,L40S
166,4096,8,4,0.22630399465560913,3066,7503,L40S
167,2048,8,3,0.24375998973846436,3066,7503,L40S
168,2048,1,2,0.24883200228214264,3066,7503,L40S
169,4096,8,0,2.6567678451538086,3066,7503,L40S
170,4096,2,3,2.6460161209106445,3066,7503,L40S
171,512,32,5,0.3123199939727783,5322,4212,L40S
172,4096,8,2,0.23449599742889404,5322,4212,L40S
173,64,1,1,0.31436800956726074,5322,4212,L40S
174,256,16,2,0.2754560112953186,5322,4212,L40S
175,128,32,2,0.7639039754867554,5322,4212,L40S
176,1024,4,5,0.2590720057487488,5322,4212,L40S
177,32,32,2,2.7156479358673096,5322,4212,L40S
178,4096,8,4,0.23449599742889404,5322,4212,L40S
179,2048,8,3,0.2457599937915802,5322,4212,L40S
180,2048,1,2,0.2457599937915802,5322,4212,L40S
181,4096,8,0,2.6967039108276367,5322,4212,L40S
182,4096,2,2,2.7043840885162354,5322,4212,L40S
183,512,32,5,2.061311960220337,14790,12000,L40S
184,4096,8,2,1.8657280206680298,14790,12000,L40S
185,64,1,1,2.2824959754943848,14790,12000,L40S
186,256,16,2,1.938431978225708,14790,12000,L40S
187,128,32,2,5.801983833312988,14790,12000,L40S
188,1024,4,5,1.9179519414901733,14790,12000,L40S
189,32,32,2,21.170175552368164,14790,12000,L40S
190,4096,8,4,1.8657280206680298,14790,12000,L40S
191,2048,8,3,1.8595839738845825,14790,12000,L40S
192,2048,1,2,1.908735990524292,14790,12000,L40S
193,8192,8,3,2.7627358436584473,14790,12000,L40S
194,2048,8,0,2.746367931365967,14790,12000,L40S
195,16,8,3,2.7648000717163086,14790,12000,L40S
196,1024,2,5,2.7386879920959473,14790,12000,L40S
197,2048,16,5,2.7100160121917725,14790,12000,L40S
198,128,8,4,2.7059199810028076,14790,12000,L40S
199,32,4,5,2.718719959259033,14790,12000,L40S
200,2048,4,2,2.6849279403686523,14790,12000,L40S
201,4096,8,1,2.677760124206543,14790,12000,L40S
202,512,32,5,3.246079921722412,15370,17670,L40S
203,4096,8,2,2.836479902267456,15370,17670,L40S
204,64,1,1,3.527679920196533,15370,17670,L40S
205,256,16,2,2.994175910949707,15370,17670,L40S
206,128,32,2,8.876031875610352,15370,17670,L40S
207,1024,4,5,2.9972479343414307,15370,17670,L40S
208,32,32,2,32.37580871582031,15370,17670,L40S
209,4096,8,4,2.8395519256591797,15370,17670,L40S
210,2048,8,3,2.860032081604004,15370,17670,L40S
211,2048,1,2,2.9327359199523926,15370,17670,L40S
212,4096,8,0,2.6849441528320312,15370,17670,L40S
213,8192,8,0,2.6757121086120605,15370,17670,L40S
214,16,8,0,2.7351040840148926,15370,17670,L40S
215,512,2,0,2.7095041275024414,15370,17670,L40S
216,64,2,5,3.487744092941284,15370,17670,L40S
217,32,8,0,2.73305606842041,15370,17670,L40S
218,512,1,0,2.7392001152038574,15370,17670,L40S
219,128,8,4,2.7678720951080322,15370,17670,L40S
220,512,16,0,2.746367931365967,15370,17670,L40S
221,32,16,0,2.7688961029052734,15370,17670,L40S
222,128,32,0,2.7453439235687256,15370,17670,L40S
223,256,1,5,2.7258880138397217,15370,17670,L40S
224,512,32,5,6.172671794891357,16363,31350,L40S
225,4096,8,2,5.191136360168457,16363,31350,L40S
226,64,1,1,6.975488185882568,16363,31350,L40S
227,256,16,2,5.800960063934326,16363,31350,L40S
228,128,32,2,16.703487396240234,16363,31350,L40S
229,1024,4,5,5.786111831665039,16363,31350,L40S
230,32,32,2,61.1143684387207,16363,31350,L40S
231,4096,8,4,5.196800231933594,16363,31350,L40S
232,2048,8,3,5.338111877441406,16363,31350,L40S
233,2048,1,2,5.296127796173096,16363,31350,L40S
234,4096,8,0,2.840575933456421,16363,31350,L40S
235,8192,8,0,2.8190720081329346,16363,31350,L40S
236,16,8,0,3.4560000896453857,16363,31350,L40S
237,1024,8,0,2.7156479358673096,16363,31350,L40S
238,64,2,5,2.7238399982452393,16363,31350,L40S
239,64,1,5,2.770944118499756,16363,31350,L40S
240,64,16,2,2.712575912475586,16363,31350,L40S
241,32,16,2,2.708479881286621,16363,31350,L40S
242,128,16,2,2.7607040405273438,16363,31350,L40S
243,32,2,5,2.727936029434204,16363,31350,L40S
244,512,16,4,2.7115519046783447,16363,31350,L40S
245,512,2,5,2.722815990447998,16363,31350,L40S
246,128,8,5,2.698751926422119,16363,31350,L40S
247,128,4,0,2.6961917877197266,16363,31350,L40S
248,32,4,0,2.770944118499756,16363,31350,L40S
249,512,2,0,3.443711996078491,16363,31350,L40S
250,256,8,5,2.7289600372314453,16363,31350,L40S
251,32,16,1,2.7197439670562744,16363,31350,L40S
252,32,8,2,2.747391939163208,16363,31350,L40S
253,128,4,1,2.7115519046783447,16363,31350,L40S
254,128,1,5,2.7934720516204834,16363,31350,L40S
255,16,16,5,2.771967887878418,16363,31350,L40S
256,2048,8,5,2.724832057952881,16363,31350,L40S
257,128,4,3,2.713599920272827,16363,31350,L40S
258,512,32,5,5.240799903869629,16381,26936,L40S
259,4096,8,2,4.477952003479004,16381,26936,L40S
260,64,1,1,5.951488018035889,16381,26936,L40S
261,256,16,2,4.9443840980529785,16381,26936,L40S
262,128,32,2,14.343679428100586,16381,26936,L40S
263,1024,4,5,4.9541120529174805,16381,26936,L40S
264,32,32,2,52.44518280029297,16381,26936,L40S
265,4096,8,4,4.482048034667969,16381,26936,L40S
266,2048,8,3,4.595200061798096,16381,26936,L40S
267,2048,1,2,4.569087982177734,16381,26936,L40S
268,4096,8,0,2.736128091812134,16381,26936,L40S
269,8192,8,0,2.7161600589752197,16381,26936,L40S
270,16,8,0,3.422208070755005,16381,26936,L40S
271,1024,8,0,2.7740159034729004,16381,26936,L40S
272,1024,2,5,2.7115519046783447,16381,26936,L40S
273,256,2,5,2.7197439670562744,16381,26936,L40S
274,1024,16,5,2.743295907974243,16381,26936,L40S
275,8192,8,5,2.736128091812134,16381,26936,L40S
276,512,2,0,2.7146239280700684,16381,26936,L40S
277,32,2,0,2.8385279178619385,16381,26936,L40S
278,32,8,2,2.692095994949341,16381,26936,L40S
279,128,4,4,2.702336072921753,16381,26936,L40S
280,128,1,4,2.7059199810028076,16381,26936,L40S
281,128,4,2,2.6956801414489746,16381,26936,L40S
282,128,8,4,2.698240041732788,16381,26936,L40S
283,64,8,1,3.3751039505004883,16381,26936,L40S
284,2048,2,0,2.732032060623169,16381,26936,L40S
285,8192,8,1,2.770944118499756,16381,26936,L40S
286,128,1,3,2.7351040840148926,16381,26936,L40S
287,32,4,5,2.777087926864624,16381,26936,L40S
288,64,32,5,2.7197439670562744,16381,26936,L40S
289,512,32,5,0.07782399654388428,125,16261,L40S
290,4096,8,2,0.07168000191450119,125,16261,L40S
291,64,1,1,0.03174399957060814,125,16261,L40S
292,256,16,2,0.04198399931192398,125,16261,L40S
293,128,32,2,0.08191999793052673,125,16261,L40S
294,1024,4,5,0.03174399957060814,125,16261,L40S
295,32,32,2,0.26316800713539124,125,16261,L40S
296,4096,8,4,0.07168000191450119,125,16261,L40S
297,2048,8,3,0.043007999658584595,125,16261,L40S
298,2048,1,2,0.05119999870657921,125,16261,L40S
299,64,2,1,2.7566239833831787,125,16261,L40S
300,1024,4,0,2.7781119346618652,125,16261,L40S
301,16,4,5,2.706943988800049,125,16261,L40S
302,512,32,5,0.47308799624443054,15014,2475,L40S
303,4096,8,2,0.4126720130443573,15014,2475,L40S
304,64,1,1,0.49663999676704407,15014,2475,L40S
305,256,16,2,0.43110400438308716,15014,2475,L40S
306,128,32,2,1.2390400171279907,15014,2475,L40S
307,1024,4,5,0.4188160002231598,15014,2475,L40S
308,32,32,2,4.463615894317627,15014,2475,L40S
309,4096,8,4,0.4126720130443573,15014,2475,L40S
310,2048,8,3,0.40755200386047363,15014,2475,L40S
311,2048,1,2,0.40959998965263367,15014,2475,L40S
312,8192,8,3,3.5532801151275635,15014,2475,L40S
313,2048,8,0,2.781183958053589,15014,2475,L40S
314,2048,2,3,3.609600067138672,15014,2475,L40S
315,16,4,5,3.625983953475952,15014,2475,L40S
316,128,8,3,4.311039924621582,15014,2475,L40S
317,2048,4,2,3.590143918991089,15014,2475,L40S
318,128,4,4,3.5737600326538086,15014,2475,L40S
319,128,8,4,4.078591823577881,15014,2475,L40S
320,2048,4,3,3.5696640014648438,15014,2475,L40S
321,512,32,5,6.087679862976074,16154,30624,L40S
322,4096,8,2,5.128704071044922,16154,30624,L40S
323,64,1,1,6.605311870574951,16154,30624,L40S
324,256,16,2,5.5808000564575195,16154,30624,L40S
325,128,32,2,16.178688049316406,16154,30624,L40S
326,1024,4,5,5.57260799407959,16154,30624,L40S
327,32,32,2,59.0274543762207,16154,30624,L40S
328,4096,8,4,5.139455795288086,16154,30624,L40S
329,2048,8,3,5.16044807434082,16154,30624,L40S
330,2048,1,2,5.323775768280029,16154,30624,L40S
331,4096,8,3,2.7740159034729004,16154,30624,L40S
332,16,8,3,2.7745280265808105,16154,30624,L40S
333,8192,8,3,2.8098559379577637,16154,30624,L40S
334,1024,8,3,2.7991199493408203,16154,30624,L40S
335,1024,2,5,3.1652159690856934,16154,30624,L40S
336,32,8,3,3.507200002670288,16154,30624,L40S
337,128,8,3,3.5491840839385986,16154,30624,L40S
338,32,2,5,3.5921919345855713,16154,30624,L40S
339,512,8,3,4.217919826507568,16154,30624,L40S
340,1024,8,1,3.507200002670288,16154,30624,L40S
341,128,2,1,3.4959359169006348,16154,30624,L40S
342,512,32,5,0.971776008605957,16331,5080,L40S
343,4096,8,2,0.8960000276565552,16331,5080,L40S
344,64,1,1,1.07315194606781,16331,5080,L40S
345,256,16,2,0.9103360176086426,16331,5080,L40S
346,128,32,2,2.7258880138397217,16331,5080,L40S
347,1024,4,5,0.9093120098114014,16331,5080,L40S
348,32,32,2,9.923583984375,16331,5080,L40S
349,4096,8,4,0.8929280042648315,16331,5080,L40S
350,2048,8,3,0.8847360014915466,16331,5080,L40S
351,2048,1,2,0.8673279881477356,16331,5080,L40S
352,2048,1,0,2.7253761291503906,16331,5080,L40S
353,8192,1,2,2.805759906768799,16331,5080,L40S
354,2048,1,3,2.8544158935546875,16331,5080,L40S
355,2048,1,5,2.7059199810028076,16331,5080,L40S
356,2048,2,3,3.1487998962402344,16331,5080,L40S
357,16,4,5,2.7156479358673096,16331,5080,L40S
358,128,8,4,2.7197439670562744,16331,5080,L40S
359,128,1,2,2.7105278968811035,16331,5080,L40S
360,128,32,5,2.742271900177002,16331,5080,L40S
361,1024,2,4,2.718719959259033,16331,5080,L40S
362,512,32,5,0.07168000191450119,10009,352,L40S
363,4096,8,2,0.04505600035190582,10009,352,L40S
364,64,1,1,0.05427199974656105,10009,352,L40S
365,256,16,2,0.058368001133203506,10009,352,L40S
366,128,32,2,0.14131200313568115,10009,352,L40S
367,1024,4,5,0.04915200173854828,10009,352,L40S
368,32,32,2,0.4423680007457733,10009,352,L40S
369,4096,8,4,0.04608000069856644,10009,352,L40S
370,2048,8,3,0.048128001391887665,10009,352,L40S
371,2048,1,2,0.04198399931192398,10009,352,L40S
372,16,1,2,2.726912021636963,10009,352,L40S
373,2048,1,0,2.6977438926696777,10009,352,L40S
374,2048,2,2,2.6941440105438232,10009,352,L40S
375,8192,8,5,2.701824188232422,10009,352,L40S
376,16,2,0,2.6992640495300293,10009,352,L40S
377,16,4,5,3.117568016052246,10009,352,L40S
378,1024,2,0,2.7054080963134766,10009,352,L40S
379,8192,1,0,2.708479881286621,10009,352,L40S
380,32,8,3,2.708479881286621,10009,352,L40S
381,16,8,4,2.890752077102661,10009,352,L40S
382,512,32,5,0.1443839967250824,8598,1188,L40S
383,4096,8,2,0.11980800330638885,8598,1188,L40S
384,64,1,1,0.14028799533843994,8598,1188,L40S
385,256,16,2,0.1382399946451187,8598,1188,L40S
386,128,32,2,0.3553760051727295,8598,1188,L40S
387,1024,4,5,0.12492799758911133,8598,1188,L40S
388,32,32,2,1.240064024925232,8598,1188,L40S
389,4096,8,4,0.11980800330638885,8598,1188,L40S
390,2048,8,3,0.1228799968957901,8598,1188,L40S
391,2048,1,2,0.11673600226640701,8598,1188,L40S
392,16,1,2,2.742271900177002,8598,1188,L40S
393,2048,2,2,2.722815990447998,8598,1188,L40S
394,2048,1,0,2.702336072921753,8598,1188,L40S
395,8192,8,4,2.697728157043457,8598,1188,L40S
396,2048,1,3,2.855423927307129,8598,1188,L40S
397,8192,4,5,2.716671943664551,8598,1188,L40S
398,1024,4,2,3.4611198902130127,8598,1188,L40S
399,512,8,0,2.708479881286621,8598,1188,L40S
400,32,4,0,2.6941440105438232,8598,1188,L40S
401,32,16,5,2.6992640495300293,8598,1188,L40S
402,512,32,5,0.09523200243711472,11562,478,L40S
403,4096,8,2,0.06656000018119812,11562,478,L40S
404,64,1,1,0.07782399654388428,11562,478,L40S
405,256,16,2,0.08601599931716919,11562,478,L40S
406,128,32,2,0.20479999482631683,11562,478,L40S
407,1024,4,5,0.07065600156784058,11562,478,L40S
408,32,32,2,0.6799359917640686,11562,478,L40S
409,4096,8,4,0.06758400052785873,11562,478,L40S
410,2048,8,3,0.06860800087451935,11562,478,L40S
411,2048,1,2,0.05632000043988228,11562,478,L40S
412,2048,1,3,2.7054080963134766,11562,478,L40S
413,2048,1,0,2.746367931365967,11562,478,L40S
414,16,1,2,2.692095994949341,11562,478,L40S
415,2048,8,5,2.6997759342193604,11562,478,L40S
416,256,8,2,2.718207836151123,11562,478,L40S
417,8192,4,5,2.771967887878418,11562,478,L40S
418,32,4,5,2.8733439445495605,11562,478,L40S
419,16,32,2,2.7392001152038574,11562,478,L40S
420,2048,2,2,2.73305606842041,11562,478,L40S
421,128,8,4,2.751487970352173,11562,478,L40S
422,512,32,5,3.458048105239868,10938,26280,L40S
423,4096,8,2,3.0115840435028076,10938,26280,L40S
424,64,1,1,3.7811198234558105,10938,26280,L40S
425,256,16,2,3.2194559574127197,10938,26280,L40S
426,128,32,2,9.409536361694336,10938,26280,L40S
427,1024,4,5,3.2174079418182373,10938,26280,L40S
428,32,32,2,34.224639892578125,10938,26280,L40S
429,4096,8,4,2.9777920246124268,10938,26280,L40S
430,2048,8,3,3.033087968826294,10938,26280,L40S
431,2048,1,2,3.1134719848632812,10938,26280,L40S
432,16,8,4,2.7351040840148926,10938,26280,L40S
433,16,8,0,2.7197439670562744,10938,26280,L40S
434,8192,8,0,2.743295907974243,10938,26280,L40S
435,1024,2,5,2.7156479358673096,10938,26280,L40S
436,32,8,0,2.7340800762176514,10938,26280,L40S
437,1024,1,5,2.703360080718994,10938,26280,L40S
438,2048,16,2,3.146751880645752,10938,26280,L40S
439,128,8,4,2.766848087310791,10938,26280,L40S
440,64,1,5,2.792448043823242,10938,26280,L40S
441,512,8,0,3.3320960998535156,10938,26280,L40S
442,32,1,5,3.250688076019287,10938,26280,L40S
443,16,8,5,3.6362240314483643,10938,26280,L40S
444,1024,16,5,3.259903907775879,10938,26280,L40S
445,128,1,4,3.2522239685058594,10938,26280,L40S
446,32,32,3,3.2128000259399414,10938,26280,L40S
447,8192,32,2,3.2921600341796875,10938,26280,L40S
448,512,32,5,0.028672000393271446,8129,144,L40S
449,4096,8,2,0.01740800030529499,8129,144,L40S
450,64,1,1,0.02252800017595291,8129,144,L40S
451,256,16,2,0.023552000522613525,8129,144,L40S
452,128,32,2,0.058368001133203506,8129,144,L40S
453,1024,4,5,0.01740800030529499,8129,144,L40S
454,32,32,2,0.15462400019168854,8129,144,L40S
455,4096,8,4,0.01740800030529499,8129,144,L40S
456,2048,8,3,0.01841600053012371,8129,144,L40S
457,2048,1,2,0.01740800030529499,8129,144,L40S
458,128,2,2,2.7345919609069824,8129,144,L40S
459,2048,4,0,2.663424015045166,8129,144,L40S
460,512,32,5,0.07782399654388428,7191,546,L40S
461,4096,8,2,0.05124799907207489,7191,546,L40S
462,64,1,1,0.062463998794555664,7191,546,L40S
463,256,16,2,0.06656000018119812,7191,546,L40S
464,128,32,2,0.1515520066022873,7191,546,L40S
465,1024,4,5,0.05632000043988228,7191,546,L40S
466,32,32,2,0.48947200179100037,7191,546,L40S
467,4096,8,4,0.05222399905323982,7191,546,L40S
468,2048,8,3,0.05427199974656105,7191,546,L40S
469,2048,1,2,0.05119999870657921,7191,546,L40S
470,16,1,2,2.722815990447998,7191,546,L40S
471,2048,1,0,2.6767361164093018,7191,546,L40S
472,2048,2,2,2.7258880138397217,7191,546,L40S
473,8192,8,5,2.6705920696258545,7191,546,L40S
474,32,2,5,2.6818559169769287,7191,546,L40S
475,8192,2,0,2.659327983856201,7191,546,L40S
476,64,16,1,2.7555840015411377,7191,546,L40S
477,256,1,2,2.683903932571411,7191,546,L40S
478,8192,2,1,2.718719959259033,7191,546,L40S
479,2048,2,3,2.7412478923797607,7191,546,L40S
480,512,32,5,0.048128001391887665,8871,240,L40S
481,4096,8,2,0.027648000046610832,8871,240,L40S
482,64,1,1,0.03577600046992302,8871,240,L40S
483,256,16,2,0.035840000957250595,8871,240,L40S
484,128,32,2,0.09523200243711472,8871,240,L40S
485,1024,4,5,0.028672000393271446,8871,240,L40S
486,32,32,2,0.2754560112953186,8871,240,L40S
487,4096,8,4,0.026623999699950218,8871,240,L40S
488,2048,8,3,0.027648000046610832,8871,240,L40S
489,2048,1,2,0.025599999353289604,8871,240,L40S
490,8192,1,4,3.201535940170288,8871,240,L40S
491,2048,2,4,2.8989439010620117,8871,240,L40S
492,2048,1,0,2.7545599937438965,8871,240,L40S
493,16,8,3,2.7504639625549316,8871,240,L40S
494,16,32,1,2.75763201713562,8871,240,L40S
495,256,8,4,2.738176107406616,8871,240,L40S
496,1024,4,1,2.7453439235687256,8871,240,L40S
497,16,32,5,2.738176107406616,8871,240,L40S
498,8192,2,3,2.7351040840148926,8871,240,L40S
499,4096,8,1,2.726912021636963,8871,240,L40S
500,512,32,5,0.05427199974656105,12466,203,L40S
501,4096,8,2,0.027648000046610832,12466,203,L40S
502,64,1,1,0.03891199827194214,12466,203,L40S
503,256,16,2,0.04095999896526337,12466,203,L40S
504,128,32,2,0.11059200018644333,12466,203,L40S
505,1024,4,5,0.03174399957060814,12466,203,L40S
506,32,32,2,0.3246400058269501,12466,203,L40S
507,4096,8,4,0.027135999873280525,12466,203,L40S
508,2048,8,3,0.02969600073993206,12466,203,L40S
509,2048,1,2,0.027648000046610832,12466,203,L40S
510,4096,8,0,2.7064318656921387,12466,203,L40S
511,2048,2,4,3.516416072845459,12466,203,L40S
512,16,8,4,2.762784004211426,12466,203,L40S
513,8192,4,5,2.835520029067993,12466,203,L40S
514,16,32,1,3.240960121154785,12466,203,L40S
515,512,4,5,3.5317440032958984,12466,203,L40S
516,8192,1,2,3.544127941131592,12466,203,L40S
517,64,8,4,3.2240638732910156,12466,203,L40S
518,512,32,5,0.2539519965648651,18,62517,L40S
519,4096,8,2,0.17612800002098083,18,62517,L40S
520,64,1,1,0.03891199827194214,18,62517,L40S
521,256,16,2,0.08191999793052673,18,62517,L40S
522,128,32,2,0.26214399933815,18,62517,L40S
523,1024,4,5,0.050175998359918594,18,62517,L40S
524,32,32,2,0.26419198513031006,18,62517,L40S
525,4096,8,4,0.17715199291706085,18,62517,L40S
526,2048,8,3,0.0942080020904541,18,62517,L40S
527,2048,1,2,0.09625600278377533,18,62517,L40S
528,64,4,1,2.6798079013824463,18,62517,L40S
529,2048,16,0,2.8446719646453857,18,62517,L40S
530,64,2,1,2.9127678871154785,18,62517,L40S
531,512,32,5,2.4637439250946045,11377,17664,L40S
532,4096,8,2,2.0633599758148193,11377,17664,L40S
533,64,1,1,2.629631996154785,11377,17664,L40S
534,256,16,2,2.219007968902588,11377,17664,L40S
535,128,32,2,6.559743881225586,11377,17664,L40S
536,1024,4,5,2.23795223236084,11377,17664,L40S
537,32,32,2,23.969791412353516,11377,17664,L40S
538,4096,8,4,2.061311960220337,11377,17664,L40S
539,2048,8,3,2.1125121116638184,11377,17664,L40S
540,2048,1,2,2.0992000102996826,11377,17664,L40S
541,4096,2,4,2.7007999420166016,11377,17664,L40S
542,4096,8,0,2.6659841537475586,11377,17664,L40S
543,16,8,4,2.6572799682617188,11377,17664,L40S
544,8192,8,4,2.8436639308929443,11377,17664,L40S
545,4096,4,3,2.6746878623962402,11377,17664,L40S
546,16,4,5,2.702847957611084,11377,17664,L40S
547,256,1,3,2.6711039543151855,11377,17664,L40S
548,8192,16,5,2.6798079013824463,11377,17664,L40S
549,512,32,5,1.070080041885376,8129,11258,L40S
550,4096,8,2,0.9651200175285339,8129,11258,L40S
551,64,1,1,1.1663360595703125,8129,11258,L40S
552,256,16,2,0.9809920191764832,8129,11258,L40S
553,128,32,2,3.009536027908325,8129,11258,L40S
554,1024,4,5,1.0045440196990967,8129,11258,L40S
555,32,32,2,10.942463874816895,8129,11258,L40S
556,4096,8,4,0.9625599980354309,8129,11258,L40S
557,2048,8,3,0.9697279930114746,8129,11258,L40S
558,2048,1,2,0.9625599980354309,8129,11258,L40S
559,8192,1,4,2.7560958862304688,8129,11258,L40S
560,2048,1,0,2.6659841537475586,8129,11258,L40S
561,16,1,4,2.834944009780884,8129,11258,L40S
562,2048,1,3,2.677760124206543,8129,11258,L40S
563,4096,2,3,3.398655891418457,8129,11258,L40S
564,512,2,4,2.6900479793548584,8129,11258,L40S
565,2048,2,4,2.6725759506225586,8129,11258,L40S
566,1024,2,5,2.683903932571411,8129,11258,L40S
567,512,32,5,0.01945599913597107,2432,290,L40S
568,4096,8,2,0.011264000087976456,2432,290,L40S
569,64,1,1,0.013311999849975109,2432,290,L40S
570,256,16,2,0.015359999611973763,2432,290,L40S
571,128,32,2,0.030719999223947525,2432,290,L40S
572,1024,4,5,0.01228800043463707,2432,290,L40S
573,32,32,2,0.0942080020904541,2432,290,L40S
574,4096,8,4,0.011264000087976456,2432,290,L40S
575,2048,8,3,0.011264000087976456,2432,290,L40S
576,2048,1,2,0.013311999849975109,2432,290,L40S
577,512,2,3,3.168272018432617,2432,290,L40S
578,16,16,5,2.751487970352173,2432,290,L40S
579,512,32,5,0.04198399931192398,1875,957,L40S
580,4096,8,2,0.023552000522613525,1875,957,L40S
581,64,1,1,0.03174399957060814,1875,957,L40S
582,256,16,2,0.03174399957060814,1875,957,L40S
583,128,32,2,0.07884799689054489,1875,957,L40S
584,1024,4,5,0.02457600086927414,1875,957,L40S
585,32,32,2,0.23347200453281403,1875,957,L40S
586,4096,8,4,0.023552000522613525,1875,957,L40S
587,2048,8,3,0.023552000522613525,1875,957,L40S
588,2048,1,2,0.021503999829292297,1875,957,L40S
589,2048,1,0,3.604480028152466,1875,957,L40S
590,8192,1,2,3.6136960983276367,1875,957,L40S
591,16,1,2,3.6137280464172363,1875,957,L40S
592,2048,8,5,3.5676159858703613,1875,957,L40S
593,1024,2,5,3.6413440704345703,1875,957,L40S
594,16,4,5,3.595263957977295,1875,957,L40S
595,512,8,4,3.6024320125579834,1875,957,L40S
596,2048,4,3,3.59116792678833,1875,957,L40S
597,128,32,5,3.570688009262085,1875,957,L40S
598,16,8,4,3.6075520515441895,1875,957,L40S
599,512,32,5,0.03276799991726875,2867,472,L40S
600,4096,8,2,0.018943998962640762,2867,472,L40S
601,64,1,1,0.02457600086927414,2867,472,L40S
602,256,16,2,0.025599999353289604,2867,472,L40S
603,128,32,2,0.062463998794555664,2867,472,L40S
604,1024,4,5,0.01945599913597107,2867,472,L40S
605,32,32,2,0.17817600071430206,2867,472,L40S
606,4096,8,4,0.01945599913597107,2867,472,L40S
607,2048,8,3,0.01945599913597107,2867,472,L40S
608,2048,1,2,0.018432000651955605,2867,472,L40S
609,16,1,2,3.615744113922119,2867,472,L40S
610,2048,1,0,3.595263957977295,2867,472,L40S
611,2048,2,3,4.314015865325928,2867,472,L40S
612,8192,8,2,3.5788800716400146,2867,472,L40S
613,2048,4,3,3.5891199111938477,2867,472,L40S
614,4096,8,3,4.291584014892578,2867,472,L40S
615,1024,2,4,4.215295791625977,2867,472,L40S
616,32,2,5,2.75763201713562,2867,472,L40S
617,1024,2,5,2.7791359424591064,2867,472,L40S
618,2048,32,5,2.718719959259033,2867,472,L40S
619,512,32,5,0.3614720106124878,12215,2268,L40S
620,4096,8,2,0.31334400177001953,12215,2268,L40S
621,64,1,1,0.3829759955406189,12215,2268,L40S
622,256,16,2,0.3338240087032318,12215,2268,L40S
623,128,32,2,0.9308159947395325,12215,2268,L40S
624,1024,4,5,0.3246240019798279,12215,2268,L40S
625,32,32,2,3.3320960998535156,12215,2268,L40S
626,4096,8,4,0.31334400177001953,12215,2268,L40S
627,2048,8,3,0.3123199939727783,12215,2268,L40S
628,2048,1,2,0.30668801069259644,12215,2268,L40S
629,16,1,2,2.836992025375366,12215,2268,L40S
630,2048,1,0,2.7361278533935547,12215,2268,L40S
631,2048,2,2,2.727424144744873,12215,2268,L40S
632,8192,8,5,2.7304959297180176,12215,2268,L40S
633,2048,2,3,2.7310080528259277,12215,2268,L40S
634,256,1,2,2.7392001152038574,12215,2268,L40S
635,128,8,4,2.7443199157714844,12215,2268,L40S
636,128,32,5,2.737152099609375,12215,2268,L40S
637,512,32,2,2.742271900177002,12215,2268,L40S
638,32,4,5,3.522559881210327,12215,2268,L40S
639,512,32,5,6.02623987197876,10267,46056,L40S
640,4096,8,2,4.733952045440674,10267,46056,L40S
641,64,1,1,6.8085761070251465,10267,46056,L40S
642,256,16,2,5.741552352905273,10267,46056,L40S
643,128,32,2,15.522815704345703,10267,46056,L40S
644,1024,4,5,5.4231038093566895,10267,46056,L40S
645,32,32,2,56.399871826171875,10267,46056,L40S
646,4096,8,4,4.740096092224121,10267,46056,L40S
647,2048,8,3,4.975104331970215,10267,46056,L40S
648,2048,1,2,4.9740800857543945,10267,46056,L40S
649,4096,8,0,2.7351040840148926,10267,46056,L40S
650,8192,8,0,2.8037118911743164,10267,46056,L40S
651,16,8,0,2.738176107406616,10267,46056,L40S
652,1024,8,0,2.767807960510254,10267,46056,L40S
653,64,2,5,2.7238399982452393,10267,46056,L40S
654,256,8,0,2.716671943664551,10267,46056,L40S
655,64,16,5,2.73305606842041,10267,46056,L40S
656,32,1,5,2.7340800762176514,10267,46056,L40S
657,512,8,0,2.7115519046783447,10267,46056,L40S
658,256,16,4,2.727936029434204,10267,46056,L40S
659,32,16,0,2.861056089401245,10267,46056,L40S
660,256,1,5,3.5092480182647705,10267,46056,L40S
661,32,1,2,3.1354880332946777,10267,46056,L40S
662,128,4,5,3.1237120628356934,10267,46056,L40S
663,128,1,1,3.1954240798950195,10267,46056,L40S
664,32,8,0,3.1288318634033203,10267,46056,L40S
665,128,8,2,4.118528366088867,10267,46056,L40S
666,128,4,1,2.7054080963134766,10267,46056,L40S
667,128,1,2,2.6910719871520996,10267,46056,L40S
668,128,16,0,2.707456111907959,10267,46056,L40S
669,8192,1,4,2.693120002746582,10267,46056,L40S
670,512,32,4,2.687488079071045,10267,46056,L40S
671,32,32,4,2.683903932571411,10267,46056,L40S
672,32,1,4,2.686944007873535,10267,46056,L40S
673,128,2,4,2.7003040313720703,10267,46056,L40S
674,128,32,4,3.3863680362701416,10267,46056,L40S
675,2048,32,2,2.7197439670562744,10267,46056,L40S
676,64,8,3,2.6951680183410645,10267,46056,L40S
677,2048,4,4,2.692095994949341,10267,46056,L40S
678,64,1,2,2.722815990447998,10267,46056,L40S
679,2048,32,4,2.698240041732788,10267,46056,L40S
680,2048,1,3,2.692095994949341,10267,46056,L40S
681,1024,1,3,2.693120002746582,10267,46056,L40S
682,512,32,5,0.7229440212249756,16211,3690,L40S
683,4096,8,2,0.6553599834442139,16211,3690,L40S
684,64,1,1,0.7782400250434875,16211,3690,L40S
685,256,16,2,0.6666240096092224,16211,3690,L40S
686,128,32,2,1.97324800491333,16211,3690,L40S
687,1024,4,5,0.6686720252037048,16211,3690,L40S
688,32,32,2,7.159808158874512,16211,3690,L40S
689,4096,8,4,0.6563839912414551,16211,3690,L40S
690,2048,8,3,0.6461439728736877,16211,3690,L40S
691,2048,1,2,0.6287360191345215,16211,3690,L40S
692,16,1,2,2.6859519481658936,16211,3690,L40S
693,2048,2,2,2.6859519481658936,16211,3690,L40S
694,2048,2,3,2.6767358779907227,16211,3690,L40S
695,2048,1,5,2.708479881286621,16211,3690,L40S
696,128,8,4,3.3556480407714844,16211,3690,L40S
697,128,32,5,2.7043840885162354,16211,3690,L40S
698,2048,8,5,2.687999963760376,16211,3690,L40S
699,2048,1,1,2.678783893585205,16211,3690,L40S
700,2048,1,0,2.6654720306396484,16211,3690,L40S
701,4096,32,2,2.6818559169769287,16211,3690,L40S
702,512,32,5,3.0556159019470215,16378,15903,L40S
703,4096,8,2,2.7284321784973145,16378,15903,L40S
704,64,1,1,3.3607680797576904,16378,15903,L40S
705,256,16,2,2.8426239490509033,16378,15903,L40S
706,128,32,2,8.466431617736816,16378,15903,L40S
707,1024,4,5,2.841599941253662,16378,15903,L40S
708,32,32,2,30.950336456298828,16378,15903,L40S
709,4096,8,4,2.731520175933838,16378,15903,L40S
710,2048,8,3,2.7197439670562744,16378,15903,L40S
711,2048,1,2,2.811903953552246,16378,15903,L40S
712,8192,8,3,4.356095790863037,16378,15903,L40S
713,2048,8,0,3.565567970275879,16378,15903,L40S
714,16,8,3,3.5676159858703613,16378,15903,L40S
715,1024,2,5,4.3520002365112305,16378,15903,L40S
716,2048,16,5,3.5583999156951904,16378,15903,L40S
717,2048,32,2,3.5655999183654785,16378,15903,L40S
718,32,4,1,4.386816024780273,16378,15903,L40S
719,512,1,4,3.9137279987335205,16378,15903,L40S
720,256,32,0,3.7509119510650635,16378,15903,L40S
721,512,32,5,8.767487525939941,10829,61852,L40S
722,4096,8,2,6.692864418029785,10829,61852,L40S
723,64,1,1,10.13043212890625,10829,61852,L40S
724,256,16,2,8.614912033081055,10829,61852,L40S
725,128,32,2,21.97555160522461,10829,61852,L40S
726,1024,4,5,7.635968208312988,10829,61852,L40S
727,32,32,2,80.29081726074219,10829,61852,L40S
728,4096,8,4,6.695440292358398,10829,61852,L40S
729,2048,8,3,6.972415924072266,10829,61852,L40S
730,2048,1,2,6.93452787399292,10829,61852,L40S
731,4096,8,3,2.7095038890838623,10829,61852,L40S
732,16,8,3,2.718719959259033,10829,61852,L40S
733,1024,8,3,2.831360101699829,10829,61852,L40S
734,8192,8,3,2.792448043823242,10829,61852,L40S
735,2048,8,0,2.8590080738067627,10829,61852,L40S
736,256,8,0,2.6869759559631348,10829,61852,L40S
737,32,8,0,2.6961920261383057,10829,61852,L40S
738,2048,2,5,2.7197439670562744,10829,61852,L40S
739,128,8,0,2.6910719871520996,10829,61852,L40S
740,32,1,3,2.7412638664245605,10829,61852,L40S
741,32,8,2,2.7289600372314453,10829,61852,L40S
742,2048,2,1,3.443711996078491,10829,61852,L40S
743,512,8,0,2.7114880084991455,10829,61852,L40S
744,128,8,3,2.717695951461792,10829,61852,L40S
745,32,8,1,2.6910719871520996,10829,61852,L40S
746,32,1,1,2.7064321041107178,10829,61852,L40S
747,512,32,5,7.782400131225586,10189,60075,L40S
748,4096,8,2,6.12659215927124,10189,60075,L40S
749,64,1,1,9.208831787109375,10189,60075,L40S
750,256,16,2,7.848447799682617,10189,60075,L40S
751,128,32,2,20.060672760009766,10189,60075,L40S
752,1024,4,5,6.999040126800537,10189,60075,L40S
753,32,32,2,73.27436828613281,10189,60075,L40S
754,4096,8,4,6.120448112487793,10189,60075,L40S
755,2048,8,3,6.319104194641113,10189,60075,L40S
756,2048,1,2,6.294528007507324,10189,60075,L40S
757,4096,8,0,2.7064321041107178,10189,60075,L40S
758,8192,8,0,2.6803197860717773,10189,60075,L40S
759,16,8,0,2.756608009338379,10189,60075,L40S
760,1024,8,0,2.702336072921753,10189,60075,L40S
761,64,2,5,2.7064321041107178,10189,60075,L40S
762,256,8,0,2.7095038890838623,10189,60075,L40S
763,64,16,5,3.112959861755371,10189,60075,L40S
764,32,8,0,2.747391939163208,10189,60075,L40S
765,512,8,0,2.7494399547576904,10189,60075,L40S
766,128,8,0,2.689023971557617,10189,60075,L40S
767,32,8,1,2.677759885787964,10189,60075,L40S
768,64,1,5,2.6849279403686523,10189,60075,L40S
769,32,8,2,2.703360080718994,10189,60075,L40S
770,32,16,1,2.673664093017578,10189,60075,L40S
771,32,4,5,2.6828479766845703,10189,60075,L40S
772,128,1,1,2.692095994949341,10189,60075,L40S
773,128,4,5,2.795520067214966,10189,60075,L40S
774,8192,8,5,2.6859519481658936,10189,60075,L40S
775,32,4,3,3.3761279582977295,10189,60075,L40S
776,128,1,4,2.722815990447998,10189,60075,L40S
777,128,8,5,2.7105278968811035,10189,60075,L40S
778,64,8,1,2.743295907974243,10189,60075,L40S
779,128,8,1,2.821120023727417,10189,60075,L40S
780,128,1,5,2.6961920261383057,10189,60075,L40S
781,512,32,5,3.30131196975708,8059,32799,L40S
782,4096,8,2,2.6306560039520264,8059,32799,L40S
783,64,1,1,3.620863914489746,8059,32799,L40S
784,256,16,2,2.978816032409668,8059,32799,L40S
785,128,32,2,8.639488220214844,8059,32799,L40S
786,1024,4,5,3.0003199577331543,8059,32799,L40S
787,32,32,2,31.723520278930664,8059,32799,L40S
788,4096,8,4,2.6398720741271973,8059,32799,L40S
789,2048,8,3,2.7340800762176514,8059,32799,L40S
790,2048,1,2,2.7263998985290527,8059,32799,L40S
791,4096,2,2,3.058688163757324,8059,32799,L40S
792,4096,8,0,2.8538880348205566,8059,32799,L40S
793,512,32,5,0.13926400244235992,766,10794,L40S
794,4096,8,2,0.08601599931716919,766,10794,L40S
795,64,1,1,0.12697599828243256,766,10794,L40S
796,256,16,2,0.11366400122642517,766,10794,L40S
797,128,32,2,0.289792001247406,766,10794,L40S
798,1024,4,5,0.08396799862384796,766,10794,L40S
799,32,32,2,1.0106879472732544,766,10794,L40S
800,4096,8,4,0.08499199897050858,766,10794,L40S
801,2048,8,3,0.08499199897050858,766,10794,L40S
802,2048,1,2,0.08294399827718735,766,10794,L40S
803,2048,1,3,3.2240638732910156,766,10794,L40S
804,2048,1,0,2.7289600372314453,766,10794,L40S
805,16,1,2,2.7591681480407715,766,10794,L40S
806,1024,2,5,3.1252479553222656,766,10794,L40S
807,8192,4,4,2.7504639625549316,766,10794,L40S
808,2048,1,5,2.747391939163208,766,10794,L40S
809,256,4,5,3.1165599822998047,766,10794,L40S
810,32,1,2,2.884608030319214,766,10794,L40S
811,128,8,3,2.727936029434204,766,10794,L40S
812,1024,4,3,2.7443199157714844,766,10794,L40S
813,512,32,5,0.21094399690628052,4334,3406,L40S
814,4096,8,2,0.15564799308776855,4334,3406,L40S
815,64,1,1,0.21196800470352173,4334,3406,L40S
816,256,16,2,0.18943999707698822,4334,3406,L40S
817,128,32,2,0.5058559775352478,4334,3406,L40S
818,1024,4,5,0.17510400712490082,4334,3406,L40S
819,32,32,2,1.7889280319213867,4334,3406,L40S
820,4096,8,4,0.15513598918914795,4334,3406,L40S
821,2048,8,3,0.1658879965543747,4334,3406,L40S
822,2048,1,2,0.16486400365829468,4334,3406,L40S
823,4096,2,4,2.712575912475586,4334,3406,L40S
824,4096,8,0,2.7340798377990723,4334,3406,L40S
825,16,8,4,2.7402238845825195,4334,3406,L40S
826,8192,8,4,3.093503952026367,4334,3406,L40S
827,128,4,0,2.8323841094970703,4334,3406,L40S
828,8192,8,5,2.7351040840148926,4334,3406,L40S
829,8192,4,4,2.7289600372314453,4334,3406,L40S
830,2048,4,4,2.716671943664551,4334,3406,L40S
831,512,32,5,0.01228800043463707,61,1740,L40S
832,4096,8,2,0.01228800043463707,61,1740,L40S
833,64,1,1,0.0071680000983178616,61,1740,L40S
834,256,16,2,0.009216000325977802,61,1740,L40S
835,128,32,2,0.013311999849975109,61,1740,L40S
836,1024,4,5,0.0071680000983178616,61,1740,L40S
837,32,32,2,0.01945599913597107,61,1740,L40S
838,4096,8,4,0.01228800043463707,61,1740,L40S
839,2048,8,3,0.008191999979317188,61,1740,L40S
840,2048,1,2,0.011264000087976456,61,1740,L40S
841,1024,4,0,2.721791982650757,61,1740,L40S
842,64,2,1,2.6951680183410645,61,1740,L40S
843,16,1,1,2.697216033935547,61,1740,L40S
